{
  "$schema": "./case-manifest.schema.json",
  "schema_version": "mida.case-manifest/v2",
  "manifest_revision": 1,
  "case_id": "xiongxiong_duokai",
  "display_name": "Xiongxiong multi-open holdout",
  "primary_artifact_sha256": "2848fcc0d61fb4ccacc7004c1d5393382068756fdc531025a10f31d20be81bc9",
  "artifacts": [
    {
      "sha256": "2848fcc0d61fb4ccacc7004c1d5393382068756fdc531025a10f31d20be81bc9",
      "size_bytes": 4245008,
      "role": "protected_input"
    }
  ],
  "capability_cell": {
    "platform": "windows",
    "binary_format": "pe",
    "architecture": "x86_64",
    "execution_model": "native",
    "protection_family": "oreans_candidate",
    "engine_route": "mida_plugin_oreans",
    "corpus_role": "holdout"
  },
  "static_fingerprint": {
    "artifact_sha256": "2848fcc0d61fb4ccacc7004c1d5393382068756fdc531025a10f31d20be81bc9",
    "evidence_basis": "retained_static_report",
    "pe_kind": "PE32+",
    "coff_machine": "0x8664",
    "image_base": "0x7ff7236e0000",
    "entry_rva": "0x12d9058",
    "entry_section": ".boot",
    "section_count": 23,
    "import_descriptor_count": 10,
    "has_tls": true,
    "has_relocations": true,
    "observed_markers": [
      "section:.themida",
      "section:.boot"
    ]
  },
  "execution_policy": {
    "dynamic": {
      "mode": "explicit_authorization_required",
      "fixed_sha256": "2848fcc0d61fb4ccacc7004c1d5393382068756fdc531025a10f31d20be81bc9",
      "timeout_seconds": 180,
      "process_tree_accounting_required": true
    },
    "network": {
      "mode": "deny_all",
      "network_actions_allowed": false,
      "isolation_evidence_required": true
    }
  },
  "oracle": {
    "oracle_id": null,
    "kind": "none",
    "artifact_sha256": null,
    "authority": "none",
    "use": "none"
  }
}
